{
  "$schema": "https://json-schema.org/draft/2020-12/schema",
  "$id": "publish.schema.json",
  "title": "classroom50-progress publish knobs",
  "description": "Per-classroom configuration. Lives at <classroom>/publish.json. This file is edited by humans; the publish workflow reads it to decide whether and what to publish.",
  "type": "object",
  "required": ["enabled"],
  "additionalProperties": false,
  "properties": {
    "$schema": {
      "type": "string",
      "description": "Pointer to this schema, e.g. ../schemas/publish.schema.json. Enables editor validation and autocomplete."
    },
    "enabled": {
      "type": "boolean",
      "description": "Master switch. false = classroom is excluded from the workflow matrix: no collection, no page data refresh, hidden from the classroom list. Existing data files are left untouched."
    },
    "mode": {
      "enum": ["past-due", "explicit"],
      "default": "past-due",
      "description": "past-due: show assignments whose deadline has passed (locked assignments are always skipped). explicit: show only the slugs listed in 'assignments'."
    },
    "show_early": {
      "type": "boolean",
      "default": false,
      "description": "past-due mode: also show assignments that already have at least one collected submission, even before their deadline."
    },
    "assignments": {
      "type": "array",
      "items": { "type": "string" },
      "description": "explicit mode: assignment slugs to publish, e.g. [\"regex-basics\"]. Ignored in past-due mode."
    },
    "exclude_students": {
      "type": "array",
      "items": { "type": "string" },
      "description": "Usernames never shown on the page (e.g. dropped students). Staff roles on the roster are excluded automatically."
    },
    "overrides": {
      "type": "array",
      "items": {
        "type": "object",
        "required": ["student", "assignment"],
        "additionalProperties": false,
        "properties": {
          "student": { "type": "string", "description": "Username as in the roster (case-insensitive)." },
          "assignment": { "type": "string", "description": "Assignment slug." },
          "accepted": { "type": "boolean", "default": true, "description": "true = the teacher accepted the whole assignment outside the PR review flow (e.g. a closed PR whose work was accepted): every task square is green and accepted_score is the full autograder total (or the assignment maximum when no score was collected). false = no-op entry for documentation." }
        }
      },
      "description": "Manual per-cell verdict overrides applied at generation time."
    }
  }
}
