{
  "$schema": "../schemas/publish.schema.json",
  "enabled": true,
  "mode": "explicit",
  "assignments": [
    "command-line-basics",
    "regex-basics",
    "encoding-basics",
    "bash-basics",
    "git-basics",
    "automation-basics",
    "markup-basics"
  ],
  "exclude_students": [
    "aleksiwithlove",
    "liontiger23"
  ],
  "overrides": [
    { "student": "The-Durian-art", "assignment": "git-basics", "accepted": true }
  ]
}
